,artist,title,genre,lyrics,URL
73,Van Morrison,Madame George,Singer/Songwriter,"

Down on Cyprus Avenue
With a childlike vision leaping into view
Clicking, clacking of the high heeled shoe
Ford & Fitzroy, Madame George
Marching with the soldier boy behind
He's much older with hat on drinking wine
And that smell of sweet perfume comes drifting through
The cool night air like Shalimar
And outside they're making all the stops
The kids out in the street collecting bottle-tops
Gone for cigarettes and matches in the shops
Happy taken Madame George
That's when you fall
Whoa, that's when you fall
Yeah, that's when you fall
When you fall into a trance
A sitting on a sofa playing games of chance
With your folded arms and history books you glance
Into the eyes of Madame George
And you think you found the bag
You're getting weaker and your knees begin to sag
In the corner playing dominoes in drag
The one and only Madame George
And then from outside the frosty window raps
She jumps up and says Lord have mercy I think it's the cops
And immediately drops everything she gots
Down into the street below
And you know you gotta go
On that train from Dublin up to Sandy Row
Throwing pennies at the bridges down below
And the rain, hail, sleet, and snow
Say goodbye to Madame George
Dry your eye for Madame George
Wonder why for Madame George
And as you leave, the room is filled with music, laughing, music,
dancing, music all around the room
And all the little boys come around, walking away from it all
So cold
And as you're about to leave
She jumps up and says Hey love, you forgot your gloves
And the gloves to love to love the gloves...
To say goodbye to Madame George
Dry your eye for Madame George
Wonder why for Madame George
Dry your eyes for Madame George
Say goodbye in the wind and the rain on the back street
In the backstreet, in the back street
Say goodbye to Madame George
In the backstreet, in the back street, in the back street
Down home, down home in the back street
Gotta go
Say goodbye, goodbye, goodbye
Dry your eye your eye your eye your eye your eye...
Say goodbye to Madame George
And the loves to love to love the love
Say goodbye
Oooooo
Mmmmmmm
Say goodbye goodbye goodbye goodbye to Madame George
Dry your eye for Madame George
Wonder why for Madame George
The love's to love the love's to love the love's to love...
Say goodbye, goodbye
Get on the train
Get on the train, the train, the train...
This is the train, this is the train...
Whoa, say goodbye, goodbye....
Get on the train, get on the train...
",http://azlyrics.com/lyrics/vanmorrison/madamegeorge.html
74,Jeff Buckley,Grace,Singer/Songwriter,"

There's the moon asking to stay 
Long enough for the clouds to fly me away 
Oh, it's my time coming,
I'm not afraid
Afraid to die

My fading voice sings of love, 
But she cries to the clicking of time.
Of time

Wait in the fire.
Wait in the fire. 
Wait in the fire. 
Wait in the fire. 
The fire. 

And she weeps on my arm 
Walking to the bright lights in sorrow 
Oh drink a bit of wine
We both might go tomorrow 
Oh my love 

And the rain is falling,
I believe my time has come 
It reminds me of the pain 
I might leave 
Leave behind 

Wait in the fire. 
Wait in the fire. 
Wait in the fire. 
Wait in the fire. 
The fire. 

It reminds me of the pain 
I might leave 
Leave behind 

And I feel them drown my name 
So easy to know and forget with this kiss 
I'm not afraid to go but it goes so slow

Wait in the fire. 
Wait in the fire. 
Wait in the fire. 
Wait in the fire. 
Wait in the fire. 
Wait in the fire. 
Wait in the fire. 
Wait in the fire.
",http://azlyrics.com/lyrics/jeffbuckley/grace.html
75,Warren Zevon,Werewolves of London,Singer/Songwriter,"

I saw a werewolf with a Chinese menu in his hand
Walking through the streets of Soho in the rain
He was looking for the place called Lee Ho Fook's
Going to get a big dish of beef chow mein
Werewolves of London

If you hear him howling around your kitchen door
Better not let him in
Little old lady got mutilated late last night
Werewolves of London again
Werewolves of London

He's the hairy handed gent who ran amuck in Kent
Lately he's been overheard in Mayfair
Better stay away from him
He'll rip your lungs out, Jim
I'd like to meet his tailor
Werewolves of London

Well, I saw Lon Chaney walking with the Queen
Doing the werewolves of London
I saw Lon Chaney, Jr. walking with the Queen
Doing the werewolves of London
I saw a werewolf drinking a pina colada at Trader Vic's
His hair was perfect
Werewolves of London again
Draw blood
",http://azlyrics.com/lyrics/warrenzevon/werewolvesoflondon.html
76,Lana Del Rey,The greatest,Singer/Songwriter,"

I miss Long Beach and I miss you, babe
I miss dancing with you the most of all
I miss the bar where the Beach Boys would go
Dennis' last stop before Kokomo

Those nights were on fire
We couldn't get higher
We didn't know that we had it all
But nobody warns you before the fall

And I'm wasted
Don't leave, I just need a wake-up call
I'm facing the greatest
The greatest loss of them all
The culture is lit and I had a ball
I guess I'm signing off after all

I miss New York and I miss the music
Me and my friends, we miss rock 'n' roll
I want shit to feel just like it used to
When, baby, I was doing nothing the most of all

The culture is lit, and if this is it, I had a ball
I guess that I'm burned out after all

I'm wasted
Don't leave, I just need a wake-up call
I'm facing the greatest
The greatest loss of them all
The culture is lit and I had a ball
I guess that I'm burned out after all

If this is it, I'm signing off
Miss doing nothing the most of all
Hawaii just missed that fireball
L.A. is in flames, it's getting hot
Kanye West is blond and gone
""Life on Mars?"" ain't just a song
I hope the live stream's almost on
",http://azlyrics.com/lyrics/lanadelrey/thegreatest.html
77,Bob Dylan,Mr. Tambourine Man,Singer/Songwriter,"

Hey! Mr. Tambourine Man, play a song for me
I'm not sleepy and there is no place I'm going to
Hey! Mr. Tambourine Man, play a song for me
In the jingle jangle morning I'll come followin' you

Though I know that evening's empire has returned into sand
Vanished from my hand
Left me blindly here to stand
But still not sleeping
My weariness amazes me, I'm branded on my feet
I have no one to meet
And the ancient empty street's too dead for dreaming

Hey! Mr. Tambourine Man, play a song for me
I'm not sleepy and there is no place I'm going to
Hey! Mr. Tambourine Man, play a song for me
In the jingle jangle morning I'll come followin' you

Take me on a trip upon your magic swirlin' ship
My senses have been stripped
My hands can't feel to grip
My toes too numb to step
Wait only for my boot heels to be wanderin'
I'm ready to go anywhere
I'm ready for to fade
Into my own parade
Cast your dancing spell my way
I promise to go under it

Hey! Mr. Tambourine Man, play a song for me
I'm not sleepy and there is no place I'm going to
Hey! Mr. Tambourine Man, play a song for me
In the jingle jangle morning I'll come followin' you

Though you might hear laughin', spinnin' swingin' madly across the sun
It's not aimed at anyone
It's just escapin' on the run
And but for the sky there are no fences facin'
And if you hear vague traces of skippin' reels of rhyme
To your tambourine in time
It's just a ragged clown behind
I wouldn't pay it any mind
It's just a shadow you're seein' that he's chasing

Hey! Mr. Tambourine Man, play a song for me
I'm not sleepy and there is no place I'm going to
Hey! Mr. Tambourine Man, play a song for me
In the jingle jangle morning I'll come followin' you

And take me disappearing through the smoke rings of my mind
Down the foggy ruins of time
Far past the frozen leaves
The haunted, frightened trees
Out to the windy beach
Far from the twisted reach
Of crazy sorrow
Yes, to dance beneath the diamond sky with one hand waving free
Silhouetted by the sea
Circled by the circus sands
With all memory and fate
Driven deep beneath the waves
Let me forget about today
Until tomorrow

Hey! Mr. Tambourine Man, play a song for me
I'm not sleepy and there is no place I'm going to
Hey! Mr. Tambourine Man, play a song for me
In the jingle jangle morning I'll come followin' you
",http://azlyrics.com/lyrics/bobdylan/mrtambourineman.html
78,Taylor Swift,All Too Well,Singer/Songwriter,"

I walked through the door with you, the air was cold
But something 'bout it felt like home somehow
And I left my scarf there at your sister's house
And you've still got it in your drawer even now

Oh, your sweet disposition and my wide-eyed gaze
We're singing in the car, getting lost Upstate
Autumn leaves falling down like pieces into place
And I can picture it after all these days

And I know it's long gone
And that magic's not here no more
And I might be okay
But I'm not fine at all

'Cause there we are again on that little town street
You almost ran the red 'cause you were looking over at me
Wind in my hair, I was there, I remember it all too well

Photo album on the counter, your cheeks were turning red
You used to be a little kid with glasses in a twin-sized bed
And your mother's telling stories 'bout you on a tee-ball team
You tell me 'bout your past, thinking your future was me

And I know it's long gone
And there was nothing else I could do
And I forget about you long enough
To forget why I needed to

'Cause there we are again in the middle of the night
We're dancing 'round the kitchen in the refrigerator light
Down the stairs, I was there, I remember it all too well, yeah

Maybe we got lost in translation, maybe I asked for too much
But maybe this thing was a masterpiece 'til you tore it all up
Running scared, I was there, I remember it all too well

And you call me up again just to break me like a promise
So casually cruel in the name of being honest
I'm a crumpled up piece of paper lying here
'Cause I remember it all, all, all... too well

Time won't fly, it's like I'm paralyzed by it
I'd like to be my old self again, but I'm still trying to find it
After plaid shirt days and nights when you made me your own
Now you mail back my things and I walk home alone

But you keep my old scarf from that very first week
'Cause it reminds you of innocence and it smells like me
You can't get rid of it 'cause you remember it all too well, yeah

'Cause there we are again, when I loved you so
Back before you lost the one real thing you've ever known
It was rare, I was there, I remember it all too well

Wind in my hair, you were there, you remember it all
Down the stairs, you were there, you remember it all
It was rare, I was there, I remember it all too well
",http://azlyrics.com/lyrics/taylorswift/alltoowell.html
79,Carole King,You've Got a Friend,Singer/Songwriter,"

When you're down and troubled,
And you need some love and care,
And nothing, nothing is going right
Close your eyes and think of me,
And soon I will be there
To brighten up even your darkest night.

You just call out my name
And you know wherever I am
I'll come running to see you again
Winter, spring, summer or fall
All you have to do is call
And I'll be there
You've got a friend

If the sky above you grows dark and full of clouds
And that old north wind begins to blow
Keep your head together and call my name out loud
Soon you'll hear me knocking at your door

You just call out my name
And you know wherever I am
I'll come running, running, yeah, yeah, to see you again
Winter, spring, summer or fall
All you have to do is call
And I'll be there
And I'll be there, yes I will.

Now, ain't it good to know that you've got a friend
When people can be so cold?
They'll hurt you, yes, and desert you
And take your soul if you let them,
Oh, but don't you let them

You just call out my name
And you know wherever I am
I'll come running, running, yeah, yeah, yeah, to see you again.
Winter, spring, summer or fall
All you have to do is call
And I'll be there, yes I will.
You've got a friend

You've got a friend
Ain't it good to know, you've got a friend?
Ain't it good to know?
Ain't it good to know?
Ain't it good to know, you've got a friend?

Oh yeah, now
Oh, you've got a friend
Yeah, baby
You've got a friend
Oh yeah...
You've got a friend
",http://azlyrics.com/lyrics/caroleking/youvegotafriend.html
80,Aldous Harding,The Barrel,Singer/Songwriter,"

I feel your love
I feel time is up
When I was a child, I never knew enough
What'd that do to me?
The wave of love is a transient hunt
Water's the shell and we are the nut
But I saw a hand arch out of the barrel

Look at all the peaches
How do you celebrate?
Can't appear inside of nowhere

It's already dead
I know you have the dove
I'm not getting wet
Looks like a date is set
Show the ferret to the egg
I'm not getting led along

I rushed in to hold down your page
And now I sleep 'side words you do not read with me
I hear a song from inside the maze, the very one you made
You shook at the ivory mantle
As a poet, I knew to be gentle
When you have a child, so begins the braiding
And in that braid you stay

Look at all the peaches
I want to celebrate
I can appear inside of nowhere
Look at all the peaches

It's already dead
I know you have the dove
I'm not getting wet
Looks like a date is set
Show the ferret to the egg
I'm not getting led along

The wave of love is a transient hunt
Water's the shell and we are the nut
But I saw a match struck outside the barrel

(The barrel)
It's already dead
I know you have the dove
I'm not getting wet
(The barrel)
(The barrel)
Looks like a date is set
Show the ferret to the egg
I'm not getting led along
(The barrel)
(The barrel)
It's already dead
I know you have the dove
I'm not getting wet
(The barrel)
(The barrel)
Looks like a date is set
Show the ferret to the egg
I'm not getting led along
(The barrel)
(The barrel)
(The barrel)
(The barrel)
(The barrel)
(The barrel)
(The barrel)
(The barrel)
(The barrel)
(The barrel)
(The barrel)
(The barrel)
(The barrel)
(The barrel)
(The barrel)
(The barrel)
",http://azlyrics.com/lyrics/aldousharding/thebarrel.html
81,Paul Simon,Graceland,Singer/Songwriter,"

The Mississippi Delta was shining
Like a National guitar
I am following the river
Down the highway
Through the cradle of the civil war

I'm going to Graceland
Graceland
In Memphis Tennessee
I'm going to Graceland
Poorboys and Pilgrims with families
And we are going to Graceland
My traveling companion is nine years old
He is the child of my first marriage
But I've reason to believe
We both will be received
In Graceland

She comes back to tell me she's gone
As if I didn't know that
As if I didn't know my own bed
As if I'd never noticed
The way she brushed her hair from her forehead
And she said losing love
Is like a window in your heart
Everybody sees you're blown apart
Everybody sees the wind blow

I'm going to Graceland
Memphis Tennessee
I'm going to Graceland
Poorboys and Pilgrims with families
And we are going to Graceland

And my traveling companions
Are ghosts and empty sockets
I'm looking at ghosts and empties
But I've reason to believe
We all will be received
In Graceland

There is a girl in New York City
Who calls herself the human trampoline
And sometimes when I'm falling, flying
Or tumbling in turmoil I say
Oh, so this is what she means
She means we're bouncing into Graceland
And I see losing love
Is like a window in your heart
Everybody sees you're blown apart
Everybody feels the wind blow

In Graceland, in Graceland
I'm going to Graceland
For reasons I cannot explain
There's some part of me wants to see
Graceland
And I may be obliged to defend
Every love, every ending
Or maybe there's no obligations now
Maybe I've a reason to believe
We all will be received
In Graceland
",http://azlyrics.com/lyrics/paulsimon/graceland.html
82,Leonard Cohen,Chelsea Hotel #2,Singer/Songwriter,"

I remember you well in the Chelsea Hotel, 
you were talking so brave and so sweet, 
giving me head on the unmade bed, 
while the limousines wait in the street. 
Those were the reasons and that was New York, 
we were running for the money and the flesh. 
And that was called love for the workers in song 
probably still is for those of them left. 
Ah but you got away, didn't you babe, 
you just turned your back on the crowd, 
you got away, I never once heard you say, 
I need you, I don't need you, 
I need you, I don't need you 
and all of that jiving around. 

I remember you well in the Chelsea Hotel 
you were famous, your heart was a legend. 
You told me again you preferred handsome men 
but for me you would make an exception. 
And clenching your fist for the ones like us 
who are oppressed by the figures of beauty, 
you fixed yourself, you said, ""Well never mind, 
we are ugly but we have the music."" 

And then you got away, didn't you babe... 

I don't mean to suggest that I loved you the best, 
I can't keep track of each fallen robin. 
I remember you well in the Chelsea Hotel, 
that's all, I don't even think of you that often.
",http://azlyrics.com/lyrics/leonardcohen/chelseahotel2.html
83,Joni Mitchell,Free Man in Paris,Singer/Songwriter,"

The way I see it, he said, you just can't win it
Everybody's in it for their own gain
You can't please 'em all
There's always somebody calling you down
I do my best and I do good business
There's a lot of people asking for my time
They're trying to get ahead
They're trying to be a good friend of mine

I was a free man in Paris
I felt unfettered and alive
There was nobody calling me up for favors
And no one's future to decide
You know I'd go back there tomorrow
But for the work I've taken on
Stoking the star-maker machinery 
Behind the popular song

I deal in dreamers and telephone screamers
Lately I wonder what I do it for
If I had my way
I'd just walk through those doors
And wander down the Champs-Élysées 
Going café to cabaret
Thinking how I'll feel when I find 
That very good friend of mine

I was a free man in Paris
I felt unfettered and alive
Nobody was calling me up for favors
No one's future to decide
You know I'd go back there tomorrow
But for the work I've taken on
Stoking the star-maker machinery
Behind the popular song
",http://azlyrics.com/lyrics/jonimitchell/freemaninparis.html
84,Fiona Apple,Criminal,Singer/Songwriter,"

I've been a bad, bad girl
I've been careless with a delicate man
And it's a sad, sad world
When a girl will break a boy just because she can

Don't you tell me to deny it
I've done wrong and I want to suffer for my sins
I've come to you 'cause I need guidance to be true
And I just don't know where I can begin

Ooh
What I need is a good defense
'Cause I'm feelin' like a criminal
And I need to be redeemed
To the one I've sinned against
Because he's all I ever knew of love

Heaven, help me for the way I am
Save me from these evil deeds before I get them done
I know tomorrow brings the consequence at hand
But I keep livin' this day like the next will never come

Oh, help me, but don't tell me to deny it
I've got to cleanse myself of all these lies 'til I'm good enough for him
I've got a lot to lose and I'm bettin' high, so I'm beggin' you
Before it ends just tell me where to begin

What I need is a good defense
'Cause I'm feelin' like a criminal
And I need to be redeemed
To the one I've sinned against
Because he's all I ever knew of love

Let me know the way
Before there's hell to pay
Give me room to lay the law and let me go
I've got to make a play
To make my lover stay
So, what would an angel say?
The devil wants to know

What I need is a good defense
'Cause I'm feelin' like a criminal
And I need to be redeemed
To the one I've sinned against
Because he's all I ever knew of love
What I need is a good defense
'Cause I'm feelin' like a criminal
And I need to be redeemed
To the one I've sinned against
Because he's all I ever knew of love
",http://azlyrics.com/lyrics/fionaapple/criminal.html
85,St. Vincent,New York,Singer/Songwriter,"

New York isn't New York without you, love
So far in a few blocks to be so low
And if I call you from First Avenue
Where you're the only motherfucker in the city who can handle me

New love wasn't true love, back to you, love
So much for a home run with some blue bloods
If I last-strawed you on Eighth Avenue
Where you're the only motherfucker in the city who can stand me

I have lost a hero
I have lost a friend
But for you, darling
I'd do it all again

I have lost a hero
I have lost a friend
But for you, darling
I'd do it all again

New York isn't New York without you, love
Too few of our old crew left on Astor
So if I trade our 'hood for some Hollywood
Where you're the only motherfucker in the city who would
Only motherfucker in the city who would
Only motherfucker in the city who'd forgive me

I have lost a hero
I have lost a friend
But for you, darling
I'd do it all again

I have lost a hero
I have lost a friend
But for you, darling
I'd do it all again
",http://azlyrics.com/lyrics/stvincent/newyork.html
86,David Bowie,Where Are We Now?,Singer/Songwriter,"

Had to get the train
From Potsdamer Platz
You never knew that
That I could do that
Just walking the dead

Sitting in the Dschungel
On Nürnberger Strasse
A man lost in time
Near KaDeWe
Just walking the dead

Where are we now, where are we now?
The moment you know, you know, you know

Twenty thousand people
Cross Bösebrücke
Fingers are crossed
Just in case
Walking the dead

Where are we now, where are we now?
The moment you know, you know, you know

As long as there's sun
As long as there's sun
As long as there's rain
As long as there's rain
As long as there's fire
As long as there's fire
As long as there's me
As long as there's you
",http://azlyrics.com/lyrics/davidbowie/wherearewenow.html
87,Cat Power,The Greatest,Singer/Songwriter,"

Once I wanted to be the greatest
No wind or waterfall could stall me
And then came the rush of the flood
Stars at night turned deep to dust

Melt me down
Into big black armour
Leave no trace of grace
Just in your honor
Lower me down
To culprit south
Make 'em wash a space in town
For the lead
And the dregs of my bed
I've been sleeping
Lower me down
Pin me in
Secure the grounds
For the later parade

Once I wanted to be the greatest
Two fists of solid rock
With brains that could explain
Any feeling

Lower me down
Pin me in
Secure the grounds
For the lead
And the dregs of my bed
I've been sleeping
For the later parade

Once I wanted to be the greatest
No wind or waterfall could stall me
And then came the rush of the flood
The stars at night turned deep to dust
",http://azlyrics.com/lyrics/catpower/thegreatest.html
88,Bob Dylan,Mississippi,Singer/Songwriter,"

Every step of the way, we walk the line
Your days are numbered, so are mine
Time is piling up, we struggle and we stray
We're all boxed in, nowhere to escape

City's just a jungle, more games to play
Trapped in the heart of it, tryin' to get away
I was raised in the country, I been working in the town
I been in trouble ever since I set my suitcase down

Got nothing for you, I had nothing before
Don't even have anything for myself anymore
Sky full of fire, came pouring down
Nothing you can sell me, I'll see you around

All my powers of expression and thoughts so sublime
Could never do you justice in reason or rhyme
Only one thing I did wrong
Stayed in Mississippi a day too long

Well, the devil's in the alley, mule's in the stall
Say anything you wanna, I have heard it all
I was thinking about the things that Rosie said
I was dreaming I was sleeping in Rosie's bed

Walking through the leaves, falling from the trees
Feeling like a stranger nobody sees
So many things that we never will undo
I know you're sorry, I'm sorry too

Some people will offer you their hand and some won't
Last night I knew you, tonight I don't
I need something strong to distract my mind
I'm gonna look at you 'til my eyes go blind

Well I got here following the southern star
I crossed that river just to be where you are
Only one thing I did wrong
Stayed in Mississippi a day too long

Well my ship's been split to splinters and it's sinking fast
I'm drowning in the poison, got no future, got no past
But my heart is not weary, it's light and it's free
I've got nothing but affection for all those who sailed with me

Everybody's moving, if they ain't already there
Everybody's got to move somewhere
Stick with me baby, stick with me anyhow
Things should start to get interesting right about now

My clothes are wet, tight on my skin
Not as tight as the corner that I painted myself in
I know that fortune is waiting to be kind
So give me your hand and say you'll be mine

Well, the emptiness is endless, cold as the clay
You can always come back, but you can't come back all the way
Only one thing I did wrong
Stayed in Mississippi a day too long.
",http://azlyrics.com/lyrics/bobdylan/mississippi.html
89,Nick Cave & The Bad Seeds,Where the Wild Roses Grow,Singer/Songwriter,,http://azlyrics.com/lyrics/nickcavebadseeds/wherethewildrosesgrow.html
90,Van Morrison,Into The Mystic,Singer/Songwriter,"

We were born before the wind
Also younger than the sun
Ere the bonnie boat was won as we sailed into the mystic
Hark, now hear the sailors cry
Smell the sea and feel the sky
Let your soul and spirit fly into the mystic

And when that fog horn blows I will be coming home
And when the fog horn blows I want to hear it
I don't have to fear it

And I want to rock your gypsy soul
Just like way back in the days of old
And magnificently we will flow into the mystic

When that fog horn blows you know I will be coming home
And when that fog horn whistle blows I got to hear it
I don't have to fear it

And I want to rock your gypsy soul
Just like way back in the days of old
And together we will flow into the mystic
Come on girl...

Too late to stop now...
",http://azlyrics.com/lyrics/vanmorrison/intothemystic.html
