,artist,title,genre,lyrics,URL
91,Bruce Springsteen,Streets of Philadelphia,Singer/Songwriter,"

I was bruised and battered, I couldn't tell what I felt
I was unrecognizable to myself
I saw my reflection in a window, I didn't know my own face
Oh brother are you gonna leave me wastin' away
On the Streets of Philadelphia

I walked the avenue, 'til my legs felt like stone
I heard the voices of friends vanished and gone
At night I could hear the blood in my veins
It was just as black and whispering as the rain
On the Streets of Philadelphia

Ain't no angel gonna greet me
It's just you and I, my friend
My clothes don't fit me no more
I walked a thousand miles
Just to slip this skin

The night has fallen, I'm lyin' awake
I can feel myself fading away
So receive me brother with your faithless kiss
Or will we leave each other alone like this
On the Streets of Philadelphia
",http://azlyrics.com/lyrics/brucespringsteen/streetsofphiladelphia.html
92,Bob Dylan,Sad-Eyed Lady of the Lowlands,Singer/Songwriter,"

With your mercury mouth in the missionary times
And your eyes like smoke and your prayers like rhymes
And your silver cross, and your voice like chimes
Oh, who do they think could bury you?

With your pockets well protected at last
And your streetcar visions which you place on the grass
And your flesh like silk, and your face like glass
Who could they get to carry you?

Sad-eyed lady of the lowlands
Where the sad-eyed prophet says that no man comes
My warehouse eyes, my Arabian drums
Should I put them by your gate
Or, sad-eyed lady, should I wait?

With your sheets like metal and your belt like lace
And your deck of cards missing the jack and the ace
And your basement clothes and your hollow face
Who among them can think he could outguess you?

With your silhouette when the sunlight dims
Into your eyes where the moonlight swims
And your match-book songs and your gypsy hymns
Who among them would try to impress you?

Sad-eyed lady of the lowlands
Where the sad-eyed prophets say that no man comes
My warehouse eyes, my Arabian drums
Should I put them by your gate
Or, sad-eyed lady, should I wait?

The kings of Tyrus with their convict list
Are waiting in line for their geranium kiss
And you wouldn't know it would happen like this
But who among them really wants just to kiss you?

With your childhood flames on your midnight rug
And your Spanish manners, and your mother's drugs
And your cowboy mouth and your curfew plugs
Who among them do you think could resist you?

Sad-eyed lady of the lowlands
Where the sad-eyed prophets say that no man comes
My warehouse eyes, my Arabian drums
Should I leave them by your gate
Or, sad-eyed lady, should I wait?

Oh, the farmers and the businessmen they all did decide
To show you where the dead angels are that they used to hide
But why did they pick you to sympathize with their side?
How could they ever mistake you?

They wished you'd accepted the blame for the farm
But with the sea at your feet and the phony false alarm
And with the child of the hoodlum wrapped up in your arms
How could they ever have persuaded you?

Sad-eyed lady of the lowlands
Where the sad-eyed prophets say that no man comes
My warehouse eyes, my Arabian drums
Should I leave them by your gate
Or, sad-eyed lady, should I wait?

With your sheet-metal memory of Cannery Row
And your magazine husband who one day just had to go
And your gentleness now, which you just can't help but show
Who among them do you think would employ you?

Now you stand with your thief, you're on his parole
With your holy medallion and your fingertips now that fold
And your saintlike face and your ghostlike soul
Who among them could ever think it could destroy you?

Sad-eyed lady of the lowlands
Where the sad-eyed prophets say that no man comes
My warehouse eyes, my Arabian drums
Should I leave them by your gate
Or, sad-eyed lady, should I wait?
",http://azlyrics.com/lyrics/bobdylan/sadeyedladyofthelowlands.html
93,Elliott Smith,Between The Bars,Singer/Songwriter,"

Drink up baby, stay up all night
With the things you could do
You won't but you might
The potential you'll be
That you'll never see
The promises you'll only make

Drink up with me now
And forget all about
The pressure of days
Do what I say
And I'll make you okay
And drive them away
The images stuck in your head

People you've been before
That you don't want around anymore
That push and shove and won't bend to your will
I'll keep them still

Drink up baby, look at the stars
I'll kiss you again between the bars
Where I'm seeing you there
With your hands in the air
Waiting to finally be caught

Drink up one more time
And I'll make you mine
Keep you apart,
Deep in my heart
Separate from the rest,
Where I like you the best
And keep the things you forgot

People you've been before
That you don't want around anymore
That push and shove and won't bend to your will
I'll keep them still
",http://azlyrics.com/lyrics/elliottsmith/betweenthebars.html
94,Bob Dylan,Not Dark Yet,Singer/Songwriter,"

Shadows are fallin' and I've been here all day
It's too hot to sleep and time is runnin' away
Feel like my soul has turned into steel
I've still got the scars that the sun didn't heal
There's not even room enough to be anywhere
It's not dark yet but it's gettin' there.

Well, my sense of humanity has gone down the drain
Behind every beautiful thing there's been some kind of pain
She wrote me a letter and she wrote it so kind
She put down in writin' what was in her mind
I just don't see why I should even care
It's not dark yet but it's gettin' there.

Well, I've been to London and I been to gay Paris
I've followed the river and I got to the sea
I've been down on the bottom of the world full of lies
I ain't lookin' for nothin' in anyone's eyes
Sometimes my burden is more than I can bear
It's not dark yet but it's gettin' there.

I was born here and I'll die here against my will
I know it looks like I'm movin' but I'm standin' still
Every nerve in my body is so naked and numb
I can't even remember what it was I came here to get away from
Don't even hear the murmur of a prayer
It's not dark yet but it's gettin' there.
",http://azlyrics.com/lyrics/bobdylan/notdarkyet.html
95,Tim Buckley,Song to the Siren,Singer/Songwriter,"

Long afloat on shipless oceans
I did all my best to smile
'Til your singing eyes and fingers
Drew me loving to your isle
And you sang
Sail to me
Sail to me
Let me enfold you
Here I am
Here I am
Waiting to hold you

Did I dream you dreamed about me?
Were you hare when I was fox
Now my foolish boat is leaning
Broken lovelorn on your rocks
For you sing, ""Touch me not, touch me not, come back tomorrow:
O my heart, O my heart shies from the sorrow""

I'm as puzzled as the new born child
I'm as troubled as the tide:
Should I stand amid the breakers?
Should I lie with death my bride?
Hear me sing, ""Swim to me, swim to me, let me enfold you:
Here I am, here I am, waiting to hold you""
",http://azlyrics.com/lyrics/timbuckley/songtothesiren.html
96,Bat For Lashes,Laura,Singer/Songwriter,"

You say that they've all left you behind
Your heart broke when the party died
Drape your arms around me and softly say
Can we dance upon the tables again?

When your smile is so wide and your heels are so high
You can't cry
Put your glad rags on and let's sing along
To that lonely song

You're the train that crashed my heart
You're the glitter in the dark
Ooh Laura, you're more than a superstar

And in this horror show
I've got to tell you so
Ooh Laura, you're more than a superstar

You say that you're stuck in a pale blue dream
And your tears feel hot on my bedsheets
Drape your arms around me and softly say
Can we dance upon the tables again?

When your smile is so wide and your heels are so high
You can't cry
Put your glad rags on and let's sing along
To that lonely song

You're the train that crashed my heart
You're the glitter in the dark
Ooh Laura, you're more than a superstar

You'll be famous for longer than them
Your name is tattooed on every boy's skin
Ooh Laura, you're more than a superstar

You're the train that crashed my heart
You're the glitter in the dark
Ooh Laura, you're more than a superstar

And in this old horror show
I've got to let you know
Ooh Laura, you're more than a superstar
You're more than a superstar...
",http://azlyrics.com/lyrics/batforlashes/laura.html
97,Fiona Apple,Every Single Night,Singer/Songwriter,"

Every single night, I endure the flight
Of little wings of white-flamed butterflies in my brain
These ideas of mine percolate the mind
Trickle down the spine, swarm the belly, swelling to a blaze

That's where the pain comes in like a second skeleton
Trying to fit beneath the skin, I can't fit the feelings in, oh

Every single night's alight with my brain, brain

I say to her, why'd I say it to her?
What does she think of me? That I'm not what I ought to be
That I'm what I try not to be, it's got to be somebody else's fault
I can't get caught

If what I am is what I am 'cause I does what I does
Then brother get back, 'cause my breast's gonna bust open
The rib is the shell, and a heart is the yolk
And I just made a meal for us both to choke on

Every single night's a fight with my brain, brain

I just wanna feel everything
I just wanna feel everything
I just wanna feel everything

So now I'm gonna try to be still now
Gonna renounce the mill a little while
And if we had a double-king-sized bed
We could move in it, and I'd soon forget

That what I am is what I am 'cause I does what I does
And maybe I'd relax, let my breast just bust open
My heart's made of parts of all that surround me
And that's why the devil just can't get around me

Every single night's alright, every single night's a fight
And every single fight's alright with my brain, brain

I just wanna feel everything
I just wanna feel everything
I just wanna feel everything
I just wanna feel everything
",http://azlyrics.com/lyrics/fionaapple/everysinglenight.html
98,Bruce Springsteen,Badlands,Singer/Songwriter,"

Lights out tonight, trouble in the heartland
Got a head-on collision smashin' in my guts, man
I'm caught in a cross fire that I don't understand
But there's one thing I know for sure girl

I don't give a damn for the same old played out scenes
Baby I don't give a damn for just the in betweens
Honey, I want the heart, I want the soul, I want control right now
You better listen to me baby

Talk about a dream, try to make it real
You wake up in the night with a fear so real
You spend your life waiting for a moment that just don't come
Well, don't waste your time waiting

Badlands, you gotta live it everyday
Let the broken hearts stand as the price you've gotta pay
We'll keep pushin' till it's understood
And these badlands start treating us good

Workin' in the fields till you get your back burned
Workin' 'neath the wheel till you get your facts learned
Baby I got my facts learned real good right now
You better get it straight darling

Poor man wanna be rich, rich man wanna be king
And a king ain't satisfied till he rules everything
I wanna go out tonight, I wanna find out what I got

Well I believe in the love that you gave me
I believe in the faith that could save me
I believe in the hope and I pray that some day
It may raise me above these

Badlands, you gotta live it everyday
Let the broken hearts stand as the price you've gotta pay
We'll keep pushin' till it's understood
And these badlands start treating us good

For the ones who had a notion, a notion deep inside
That it ain't no sin to be glad you're alive
I wanna find one face that ain't looking through me
I wanna find one place, I wanna spit in the face of these

Badlands, you gotta live it everyday
Let the broken hearts stand as the price you've gotta pay
Keep movin' till it's understood
And these badlands start treating us good

Whoa, whoa, whoa, whoa
Badlands, whoa whoa whoa whoa
Badlands, whoa whoa whoa whoa
Badlands, whoa whoa whoa whoa
Badlands, whoa whoa whoa whoa
Badlands, whoa whoa whoa whoa
",http://azlyrics.com/lyrics/brucespringsteen/badlands.html
99,Townes Van Zandt,Pancho and Lefty,Singer/Songwriter,"

Living on the road my friend
Is gonna keep you free and clean
Now you wear your skin like iron
And your breath as hard as kerosene
You weren't your mama's only boy
But her favorite one it seems
She began to cry when you said goodbye
And sank into your dreams

Pancho was a bandit boys
His horse was fast as polished steel
He wore his gun outside his pants
For all the honest world to feel
Pancho met his match you know
On the deserts down in Mexico
And nobody heard his dying words
Ah, but that's the way it goes

And all the Federales say
They could have had him any day
They only let him hang around
Out of kindness, I suppose

Lefty, he can't sing the blues
All night long like he used to
The dust that Pancho bit down south
Ended up in Lefty's mouth
The day they laid poor Pancho low
Lefty split for Ohio
Where he got the bread to go
There ain't nobody knows

And all the Federales say
They could have had him any day
They only let him slip away
Out of kindness, I suppose

Well the poets tell how Pancho fell
And Lefty's living in a cheap hotel
The desert's quiet and Cleveland's cold
And so the story ends we're told
Pancho needs your prayers it's true
But save a few for Lefty too
He just did what he had to do
And now he's growing old

And a few grey Federales say
They could have had him any day
They only let go so wrong
Out of kindness, I suppose

A few gray Federales say
They could have had him any day
They only let him so wrong
Out of kindness, I suppose
",http://azlyrics.com/lyrics/townesvanzandt/panchoandlefty.html
100,Bob Dylan,Simple Twist of Fate,Singer/Songwriter,"

They sat together in the park
As the evening sky grew dark
She looked at him and he felt a spark tingle to his bones
It was then he felt alone and wished that he'd gone straight
And watched out for a simple twist of fate.

They walked alone by the old canal
A little confused I remember well
And stopped into a strange hotel with a neon burning bright
He felt the heat of the night hit him like a freight train
Moving with a simple twist of fate.

A saxophone someplace far off played
As she was walking on by the arcade
As the light bust through a-beat-up shade where he was waking up
She dropped a coin into the cup of a blind man at the gate
And forgot about a simple twist of fate.

He woke up the room was bare
He didn't see her anywhere
He told himself he didn't care pushed the window open wide
Felt an emptiness inside to which he just could not relate
Brought on by a simple twist of fate.

He hears the ticking of the clocks
And walks along with a parrot that talks
Hunts her down by the waterfront docks where the sailers all come in
Maybe she'll pick him out again how long must he wait
One more time for a simple twist of fate.

People tell me it's a sin
To know and feel too much within
I still believe she was my twin but I lost the ring
She was born in spring but I was born too late
Blame it on a simple twist of fate.
",http://azlyrics.com/lyrics/bobdylan/simpletwistoffate.html
101,Bob Dylan,Girl from the North Country,Singer/Songwriter,"

If you're traveling the north country fair
Where the winds hit heavy on the borderline
Remember me to one who lives there
For she once was a true love of mine

If you go when the snowflakes storm
When the rivers freeze and summer ends
Please see if she has a coat so warm
To keep her from the howlin' winds

Please see if her hair hangs long
If it rolls and flows all down her breast
Please see for me if her hair's hanging long
For that's the way I remember her best

I'm a-wonderin' if she remembers me at all
Many times I've often prayed
In the darkness of my night
In the brightness of my day

So if you're travelin' in the north country fair
Where the winds hit heavy on the borderline
Remember me to one who lives there
She once was a true love of mine
",http://azlyrics.com/lyrics/bobdylan/girlfromthenorthcountry.html
102,Tom Waits,Tom Traubert's Blues (Four Sheets To The Wind In Copenhagen),Singer/Songwriter,"

Wasted and wounded, it ain't what the moon did, I've got what I paid for now
See you tomorrow, hey Frank, can I borrow a couple of bucks from you
To go waltzing Mathilda, waltzing Mathilda,
You'll go waltzing Mathilda with me

I'm an innocent victim of a blinded alley
And I'm tired of all these soldiers here
No one speaks English, and everything's broken, and my Stacys are soaking wet
To go waltzing Mathilda, waltzing Mathilda,
You'll go waltzing Mathilda with me

Now the dogs are barking and the taxi cab's parking
A lot they can do for me
I begged you to stab me, you tore my shirt open,
And I'm down on my knees tonight
Old Bushmill's I staggered, you'd bury the dagger
In your silhouette window light go
To go waltzing Mathilda, waltzing Mathilda,
You'll go waltzing Mathilda with me

Now I lost my Saint Christopher now that I've kissed her
And the one-armed bandit knows
And the maverick Chinamen, and the cold-blooded signs,
And the girls down by the strip-tease shows, go
Waltzing Mathilda, waltzing Mathilda,
You'll go waltzing Mathilda with me

No, I don't want your sympathy, the fugitives say
That the streets aren't for dreaming now
And manslaughter dragnets and the ghosts that sell memories,
They want a piece of the action anyhow
Go waltzing Mathilda, waltzing Mathilda,
You'll go waltzing Mathilda with me

And you can ask any sailor, and the keys from the jailor,
And the old men in wheelchairs know
And Mathilda's the defendant, she killed about a hundred,
And she follows wherever you may go
Waltzing Mathilda, waltzing Mathilda,
You'll go waltzing Mathilda with me

And it's a battered old suitcase to a hotel someplace,
And a wound that will never heal
No prima donna, the perfume is on an
Old shirt that is stained with blood and whiskey
And goodnight to the street sweepers, the night watchmen flame keepers
And goodnight to Mathilda, too
",http://azlyrics.com/lyrics/tomwaits/tomtraubertsblues.html
103,John Lennon,God,Singer/Songwriter,"

God is a Concept by which we measure our pain
I'll say it again
God is a Concept by which we measure our pain

I don't believe in magic
I don't believe in I-ching
I don't believe in Bible
I don't believe in Tarot
I don't believe in Hitler
I don't believe in Jesus
I don't believe in Kennedy
I don't believe in Buddha
I don't believe in Mantra
I don't believe in Gita
I don't believe in Yoga
I don't believe in Kings
I don't believe in Elvis
I don't believe in Zimmerman
I don't believe in Beatles

I just believe in me, Yoko and me, and that's reality

The dream is over
What can I say?
The dream is over
Yesterday
I was the dreamweaver
But now I'm reborn
I was the walrus
But now I'm John
And so, dear friends,
You'll just have to carry on
The dream is over
",http://azlyrics.com/lyrics/johnlennon/god.html
104,Eric Clapton,Tears in Heaven,Singer/Songwriter,"

Would you know my name if I saw you in heaven?
Would it be the same if I saw you in heaven?
I must be strong and carry on
'Cause I know I don't belong
Here in heaven

Would you hold my hand if I saw you in heaven?
Would you help me stand if I saw you in heaven?
I'll find my way through night and day
'Cause I know I just can't stay
Here in heaven

Time can bring you down, time can bend your knees
Time can break your heart, have you begging please
Begging please

Beyond the door, there's peace, I'm sure
And I know there'll be no more
Tears in heaven

Would you know my name if I saw you in heaven?
Would you feel the same if I saw you in heaven?
I must be strong and carry on
Because I know I don't belong
Here in heaven
",http://azlyrics.com/lyrics/ericclapton/tearsinheaven.html
105,Patti Smith,Dancing Barefoot,Singer/Songwriter,"

She is benediction
She is addicted to thee
She is the root connection
She is connecting with he

Here I go and I don't know why
I fell so ceaselessly
Could it be he's taking over me...

I'm dancing barefoot
Heading for a spin
Some strange music draws me in
Makes me come on like some heroine

She is sublimation
She is the essence of thee
She is concentrating on
He, who is chosen by she

Here I go and I don't know why
I spin so ceaselessly,
Could it be he's taking over me...

[chorus]

She is re-creation
She, intoxicated by thee
She has the slow sensation that
He is levitating with she ...

Here I go and I don't know why,
I spin so ceaselessly,
'til I lose my sense of gravity...

[chorus]

(oh god I fell for you ...)

The plot of our life sweats in the dark like a face
The mystery of childbirth, of childhood itself
Grave visitations
What is it that calls to us?
Why must we pray screaming?
Why must not death be redefined?
We shut our eyes we stretch out our arms
And whirl on a pane of glass
An afixiation a fix on anything the line of life the limb of a tree
The hands of he and the promise that she is blessed among women.

(oh god I fell for you ...)
",http://azlyrics.com/lyrics/pattismith/dancingbarefoot.html
106,Kacey Musgraves,Slow Burn,Singer/Songwriter,"

Born in a hurry, always late
Haven't been early since '88
Texas is hot, I can be cold
Grandma cried when I pierced my nose
Good in a glass, good on green
Good when you're putting your hands all over me

I'm alright with a slow burn
Taking my time, let the world turn
I'm gonna do it my way, it'll be alright
If we burn it down and it takes all night
It's a slow burn, yeah

In Tennessee, the sun's goin' down
But in Beijing, they're heading out to work
You know the bar down the street don't close for an hour
We should take a walk and look at all the flowers

'Cause I'm alright with a slow burn
Taking my time, let the world turn
I'm gonna do it my way, it'll be alright
If we burn it down and it takes all night
It's a slow burn

Whatever feels good

Old soul, waiting my turn
I know a few things, but I still got a lot to learn
So I'm alright with a slow burn, slow burn, slow burn
I'm alright with a slow burn
",http://azlyrics.com/lyrics/kaceymusgraves/slowburn.html
107,The Plastic Ono Band,Give Peace A Chance,Singer/Songwriter,,http://azlyrics.com/lyrics/plasticonoband/givepeaceachance.html
108,Gram Parsons,Return of the Grievous Angel,Singer/Songwriter,"

Won't you scratch my itch sweet Annie Rich 
And welcome me back to town
Come out on your porch or I'll step into your parlor
And I'll tell you how it all went down

Out with the truckers and the kickers and the cowboy angels
And a good saloon in every single town

Oh, and I remembered something you once told me
And I'll be damned if it did not come true
Twenty thousand roads I went down, down, down
And they all led me straight back home to you

'Cause I headed west to grow up with the country
Across those prairies with those waves of grain
And I saw my devil and I saw my deep blue sea
And I thought about a calico bonnet 
From Cheyenne to Tennessee

We flew straight across that river bridge
Last night, half past two
The switchman wave his lantern goodbye and good day
As we went rolling through
Billboards and truckstops pass by the grievous angel
And now I know just what I have to do

And the man on the radio won't leave me alone
He wants to take my money for something that I've never been shown
And I saw my devil and I saw my deep blue sea
And I thought about a calico bonnet 
From Cheyenne to Tennessee

The news I could bring, I met up with the king
On his head an amphetamine crown
He talked about unbuckling that old bible belt
And lighted out for some desert town

Out with the truckers and the kickers and the cowboy angels
And a good saloon in every single town

Oh, but I remembered something you once told me
And I'll be damned if it did not come true
Twenty thousand roads I went down, down, down
And they all led me straight back home to you
Twenty thousand roads I went down, down, down
And they all led me straight back home to you
",http://azlyrics.com/lyrics/gramparsons/returnofthegrievousangel.html
109,Phil Ochs,I Ain't Marching Anymore,Singer/Songwriter,"

Oh, I marched to the battle of New Orleans
At the end of the early British wars
The young land started growing
The young blood started flowing
But I ain't a-marching anymore

Oh I killed my share of Injuns in a thousand different fights
I was there at the Little Big Horn
I heard many men a-lying
I saw many more a-dying
But I ain't a-marching anymore

It's always the old to lead us to the wars
Always the young to fall
Now look at what we've won with a saber and a gun
Tell me is it worth it all?

For I stole California from the Mexican land
Fought in the bloody Civil War
Yes, I even killed my brothers
And so many others
But I ain't a-marching anymore

For I marched to the battle of the German trench
In a war that was bound to end all wars
Oh I must have killed a million men
And now they want me back again
But I ain't a-marching anymore

It's always the old to lead us to the wars
Always the young to fall
Now look at what we've won with a saber and a gun
Tell me is it worth it all?

For I flew the final mission in the Japanese sky
Set off the mighty mushroom roar
But I saw the cities burnin'
And I knew that I was learnin'
That I ain't a-marching anymore

Now the labor leader's screamin' when they closed the missile plant
United Fruit screams at the Cuban shore
Call it peace or call it treason
Call it love or call it reason
But I ain't a-marching anymore
I ain't a-marching anymore
",http://azlyrics.com/lyrics/philochs/iaintmarchinganymore.html
